<?xml version="1.0" encoding="UTF-8"?>
<TravelAgents xmlns="http://jd02_09.kasiyanov.it.by"
			  xmlns:xsi="http://www.w3.org/2001/XMLSchema-instance"
			  xsi:schemaLocation="http://jd02_09.kasiyanov.it.by Schema.xsd"
>

	<TravelAgent>
		<Name>Alina</Name>
		<Login>Alina</Login>
		<Pasword>qwerty</Pasword>
		<Email>Alina@gmail.com</Email>
		<TravelOffers>
			<TravelOffer>
				<Description>
					Великолепные песчаные пляжи...
				</Description>
				<TypeOfTrevel>Holiday</TypeOfTrevel>
				<Destination>Мальта</Destination>
				<Hotel>Hilton</Hotel>
				<LevelOfAccommodation>5 Stars</LevelOfAccommodation>
				<NumberOfNight>7</NumberOfNight>
				<Price>445.0</Price>
			</TravelOffer>
			<TravelOffer>
				<Description>
					Исторические достопримечательности...
				</Description>
				<TypeOfTrevel>Excursion</TypeOfTrevel>
				<Destination>Прага</Destination>
				<Hotel>ResidenceBologna</Hotel>
				<LevelOfAccommodation>3 Stars</LevelOfAccommodation>
				<NumberOfNight>2</NumberOfNight>
				<Price>215.0</Price>
			</TravelOffer>
		</TravelOffers>
	</TravelAgent>
	<TravelAgent>
		<Name>Viktoria</Name>
		<Login>Viktoria</Login>
		<Pasword>asdfg</Pasword>
		<Email>Viktoria@gmail.com</Email>
		<TravelOffers>
			<TravelOffer>
				<Description>
					Тур в Италию за самыми модными и выгодными покупками...
				</Description>
				<TypeOfTrevel>ShopTour</TypeOfTrevel>
				<Destination>Милан</Destination>
				<Hotel>Ibis Milano Centro</Hotel>
				<LevelOfAccommodation>3 Stars</LevelOfAccommodation>
				<NumberOfNight>5</NumberOfNight>
				<Price>324.0</Price>
			</TravelOffer>
		</TravelOffers>
	</TravelAgent>
</TravelAgents>